{
  "contract": "openplc-mqtt-runtime-config",
  "format_version": 1,
  "enabled": true,
  "mode": "sparkplug_b",
  "program": {
    "md5": "3f2c9d0e8b7a6f5e4d3c2b1a09f8e7d6"
  },
  "connection": {
    "host": "broker.example.net",
    "port": 8883,
    "client_id": "plc-linha1",
    "tls": {
      "enabled": true,
      "trust": {
        "source": "system"
      }
    }
  },
  "auth": {
    "method": "client_certificate",
    "credential_ref": {
      "id": "6f1c2a4e-8d3b-4c5a-9e7f-0a1b2c3d4e5f",
      "revision": 4,
      "staging_id": "0d9e8f7a-6b5c-4d3e-8f1a-2b3c4d5e6f70"
    }
  },
  "sparkplug": {
    "group_id": "Plant 1",
    "edge_node_id": "plc-linha1",
    "sample_interval_ms": 100
  },
  "leaves": [
    {
      "source": {
        "tokens": [
          {
            "role": "instance",
            "name": "Inst0"
          },
          {
            "role": "variable",
            "name": "V_BOOL"
          }
        ],
        "debug_path": "INST0.V_BOOL"
      },
      "address": {
        "arr": 0,
        "elem": 0
      },
      "iec_type": "BOOL",
      "size": 1,
      "destination": "Inst0.V_BOOL"
    },
    {
      "source": {
        "tokens": [
          {
            "role": "instance",
            "name": "Inst0"
          },
          {
            "role": "variable",
            "name": "V_SINT"
          }
        ],
        "debug_path": "INST0.V_SINT"
      },
      "address": {
        "arr": 0,
        "elem": 1
      },
      "iec_type": "SINT",
      "size": 1,
      "destination": "Inst0.V_SINT"
    },
    {
      "source": {
        "tokens": [
          {
            "role": "instance",
            "name": "Inst0"
          },
          {
            "role": "variable",
            "name": "V_USINT"
          }
        ],
        "debug_path": "INST0.V_USINT"
      },
      "address": {
        "arr": 0,
        "elem": 2
      },
      "iec_type": "USINT",
      "size": 1,
      "destination": "Inst0.V_USINT"
    },
    {
      "source": {
        "tokens": [
          {
            "role": "instance",
            "name": "Inst0"
          },
          {
            "role": "variable",
            "name": "V_INT"
          }
        ],
        "debug_path": "INST0.V_INT"
      },
      "address": {
        "arr": 0,
        "elem": 3
      },
      "iec_type": "INT",
      "size": 2,
      "destination": "Inst0.V_INT"
    },
    {
      "source": {
        "tokens": [
          {
            "role": "instance",
            "name": "Inst0"
          },
          {
            "role": "variable",
            "name": "V_UINT"
          }
        ],
        "debug_path": "INST0.V_UINT"
      },
      "address": {
        "arr": 0,
        "elem": 4
      },
      "iec_type": "UINT",
      "size": 2,
      "destination": "Inst0.V_UINT"
    },
    {
      "source": {
        "tokens": [
          {
            "role": "instance",
            "name": "Inst0"
          },
          {
            "role": "variable",
            "name": "V_DINT"
          }
        ],
        "debug_path": "INST0.V_DINT"
      },
      "address": {
        "arr": 0,
        "elem": 5
      },
      "iec_type": "DINT",
      "size": 4,
      "destination": "Inst0.V_DINT"
    },
    {
      "source": {
        "tokens": [
          {
            "role": "instance",
            "name": "Inst0"
          },
          {
            "role": "variable",
            "name": "V_UDINT"
          }
        ],
        "debug_path": "INST0.V_UDINT"
      },
      "address": {
        "arr": 0,
        "elem": 6
      },
      "iec_type": "UDINT",
      "size": 4,
      "destination": "Inst0.V_UDINT"
    },
    {
      "source": {
        "tokens": [
          {
            "role": "instance",
            "name": "Inst0"
          },
          {
            "role": "variable",
            "name": "V_LINT"
          }
        ],
        "debug_path": "INST0.V_LINT"
      },
      "address": {
        "arr": 0,
        "elem": 7
      },
      "iec_type": "LINT",
      "size": 8,
      "destination": "Inst0.V_LINT"
    },
    {
      "source": {
        "tokens": [
          {
            "role": "instance",
            "name": "Inst0"
          },
          {
            "role": "variable",
            "name": "V_ULINT"
          }
        ],
        "debug_path": "INST0.V_ULINT"
      },
      "address": {
        "arr": 0,
        "elem": 8
      },
      "iec_type": "ULINT",
      "size": 8,
      "destination": "Inst0.V_ULINT"
    },
    {
      "source": {
        "tokens": [
          {
            "role": "instance",
            "name": "Inst0"
          },
          {
            "role": "variable",
            "name": "V_REAL"
          }
        ],
        "debug_path": "INST0.V_REAL"
      },
      "address": {
        "arr": 0,
        "elem": 9
      },
      "iec_type": "REAL",
      "size": 4,
      "destination": "Inst0.V_REAL"
    },
    {
      "source": {
        "tokens": [
          {
            "role": "instance",
            "name": "Inst0"
          },
          {
            "role": "variable",
            "name": "V_LREAL"
          }
        ],
        "debug_path": "INST0.V_LREAL"
      },
      "address": {
        "arr": 0,
        "elem": 10
      },
      "iec_type": "LREAL",
      "size": 8,
      "destination": "Inst0.V_LREAL"
    },
    {
      "source": {
        "tokens": [
          {
            "role": "instance",
            "name": "Inst0"
          },
          {
            "role": "variable",
            "name": "V_BYTE"
          }
        ],
        "debug_path": "INST0.V_BYTE"
      },
      "address": {
        "arr": 0,
        "elem": 11
      },
      "iec_type": "BYTE",
      "size": 1,
      "destination": "Inst0.V_BYTE"
    },
    {
      "source": {
        "tokens": [
          {
            "role": "instance",
            "name": "Inst0"
          },
          {
            "role": "variable",
            "name": "V_WORD"
          }
        ],
        "debug_path": "INST0.V_WORD"
      },
      "address": {
        "arr": 0,
        "elem": 12
      },
      "iec_type": "WORD",
      "size": 2,
      "destination": "Inst0.V_WORD"
    },
    {
      "source": {
        "tokens": [
          {
            "role": "instance",
            "name": "Inst0"
          },
          {
            "role": "variable",
            "name": "V_DWORD"
          }
        ],
        "debug_path": "INST0.V_DWORD"
      },
      "address": {
        "arr": 0,
        "elem": 13
      },
      "iec_type": "DWORD",
      "size": 4,
      "destination": "Inst0.V_DWORD"
    },
    {
      "source": {
        "tokens": [
          {
            "role": "instance",
            "name": "Inst0"
          },
          {
            "role": "variable",
            "name": "V_LWORD"
          }
        ],
        "debug_path": "INST0.V_LWORD"
      },
      "address": {
        "arr": 0,
        "elem": 14
      },
      "iec_type": "LWORD",
      "size": 8,
      "destination": "Inst0.V_LWORD"
    },
    {
      "source": {
        "tokens": [
          {
            "role": "instance",
            "name": "Inst0"
          },
          {
            "role": "variable",
            "name": "V_TIME"
          }
        ],
        "debug_path": "INST0.V_TIME"
      },
      "address": {
        "arr": 0,
        "elem": 15
      },
      "iec_type": "TIME",
      "size": 8,
      "destination": "Inst0.V_TIME"
    },
    {
      "source": {
        "tokens": [
          {
            "role": "instance",
            "name": "Inst0"
          },
          {
            "role": "variable",
            "name": "V_DATE"
          }
        ],
        "debug_path": "INST0.V_DATE"
      },
      "address": {
        "arr": 0,
        "elem": 16
      },
      "iec_type": "DATE",
      "size": 8,
      "destination": "Inst0.V_DATE"
    },
    {
      "source": {
        "tokens": [
          {
            "role": "instance",
            "name": "Inst0"
          },
          {
            "role": "variable",
            "name": "V_TOD"
          }
        ],
        "debug_path": "INST0.V_TOD"
      },
      "address": {
        "arr": 0,
        "elem": 17
      },
      "iec_type": "TOD",
      "size": 8,
      "destination": "Inst0.V_TOD"
    },
    {
      "source": {
        "tokens": [
          {
            "role": "instance",
            "name": "Inst0"
          },
          {
            "role": "variable",
            "name": "V_DT"
          }
        ],
        "debug_path": "INST0.V_DT"
      },
      "address": {
        "arr": 0,
        "elem": 18
      },
      "iec_type": "DT",
      "size": 8,
      "destination": "Inst0.V_DT"
    },
    {
      "source": {
        "tokens": [
          {
            "role": "instance",
            "name": "Inst0"
          },
          {
            "role": "variable",
            "name": "V_STRING"
          }
        ],
        "debug_path": "INST0.V_STRING"
      },
      "address": {
        "arr": 0,
        "elem": 19
      },
      "iec_type": "STRING",
      "size": 127,
      "destination": "Inst0.V_STRING"
    },
    {
      "source": {
        "tokens": [
          {
            "role": "instance",
            "name": "Inst0"
          },
          {
            "role": "variable",
            "name": "V_WSTRING"
          }
        ],
        "debug_path": "INST0.V_WSTRING"
      },
      "address": {
        "arr": 0,
        "elem": 20
      },
      "iec_type": "WSTRING",
      "size": 253,
      "destination": "Inst0.V_WSTRING"
    }
  ]
}
